{
  "$schema": "https://json-schema.org/draft/2020-12/schema",
  "$id": "https://co-author-harness.local/schemas/verifier_transaction.schema.json",
  "type": "object",
  "additionalProperties": false,
  "required": ["schema_version", "transaction_type", "transaction_id", "state", "phase", "qualification_mode", "product_disposition", "requested_independence_level", "achieved_independence_level", "artifact", "semantic_receipt", "product_assurance", "semantics_manifest", "semantics_digest", "dependency_hashes"],
  "properties": {
    "schema_version": {"const": "1.0.0"},
    "transaction_type": {"const": "draft_evidence_verifier"},
    "transaction_id": {"type": "string", "pattern": "^verifier-[0-9a-f]{16}$"},
    "state": {"const": "prepared"},
    "phase": {"enum": ["generation", "evaluation"]},
    "qualification_mode": {"const": "governed_v3"},
    "product_disposition": {"enum": ["evaluation_ready", "product_qualified"]},
    "requested_independence_level": {"const": "none"},
    "achieved_independence_level": {"const": "none"},
    "artifact": {"$ref": "#/$defs/binding"},
    "semantic_receipt": {"$ref": "#/$defs/binding"},
    "product_assurance": {"$ref": "#/$defs/binding"},
    "semantics_manifest": {"$ref": "#/$defs/binding"},
    "semantics_digest": {"$ref": "#/$defs/sha256"},
    "dependency_hashes": {"type": "array", "minItems": 1, "items": {"type": "object", "additionalProperties": false, "required": ["path", "sha256"], "properties": {"path": {"type": "string", "minLength": 1}, "sha256": {"$ref": "#/$defs/sha256"}}}}
  },
  "allOf": [
    {"if": {"properties": {"phase": {"const": "generation"}}}, "then": {"properties": {"product_disposition": {"const": "evaluation_ready"}}}},
    {"if": {"properties": {"phase": {"const": "evaluation"}}}, "then": {"properties": {"product_disposition": {"const": "product_qualified"}}}}
  ],
  "$defs": {
    "sha256": {"type": "string", "pattern": "^[0-9a-f]{64}$"},
    "root": {"type": "object", "additionalProperties": false, "required": ["kind", "identity", "discovery", "manifest_sha256"], "properties": {"kind": {"enum": ["project", "wiki", "harness"]}, "identity": {"type": "string", "minLength": 1}, "discovery": {"type": "string", "minLength": 1}, "manifest_sha256": {"$ref": "#/$defs/sha256"}}},
    "binding": {"type": "object", "additionalProperties": false, "required": ["root", "path", "sha256", "evidence_type"], "properties": {"root": {"$ref": "#/$defs/root"}, "path": {"type": "string", "minLength": 1}, "sha256": {"$ref": "#/$defs/sha256"}, "evidence_type": {"type": "string", "minLength": 1}}}
  }
}
