{"achieved_independence_level":"none","artifact":{"evidence_type":"governed_artifact","path":"research_notes/m1_deliverable.md","root":{"discovery":"explicit:reviews/.harness/fixtures/terminal-m1/synthetic-project-manifest.json","identity":"c2-synthetic-project","kind":"project","manifest_sha256":"c4b8d95709994f81093641c7a4739267e8539b7d20a9d6dcb45552433c7104f6"},"sha256":"f4e3d2abcf25005b47967306a2608c01779bb010670c6f666e2fa10088735763"},"dependency_hashes":[{"path":"references/policies/draft_governance.v1.json","sha256":"28ad3437578468d847116744199e762d870b99ac914ee9faf170b9bc33b6b23d"},{"path":"references/schemas/assignment_dispatch_claim.schema.json","sha256":"25bbc81456d092a87131ba10aad12e0f8c93d937deee31009d104b39e1dfea17"},{"path":"references/schemas/assignment_dispatch_issuance.schema.json","sha256":"b150c9f5e0494bd84c4731642045974609b599b328c28ef9847b4a6ea42d39a6"},{"path":"references/schemas/assignment_dispatch_kernel_authorization.schema.json","sha256":"3d37d9d7781ad703d0998d265a86818d0bfd13b41a2f2bdfa9b59c67295d6941"},{"path":"references/schemas/assignment_dispatch_consumption.schema.json","sha256":"435c7c8718d16af31dc020017e5e19e9bd7fa6268873024265dd3f8bcc55e8eb"},{"path":"references/schemas/assignment_host_attestation.schema.json","sha256":"f9ea3cb8f4310ff0a842863739e8a252faaf43026dce1b897ca042271d3bf7cf"},{"path":"references/schemas/assignment_mutation_anchor.schema.json","sha256":"1b77ca752aaf11e31aaf0d37e6f79b255fb7b509d921449f491293bb83212f91"},{"path":"references/schemas/assignment_mutation_genesis.schema.json","sha256":"3d70a65d28d47431e31e3465d21c27ed41959b4adf11221b44c7b5a1d1c823b6"},{"path":"references/schemas/assignment_mutation_state.schema.json","sha256":"317404d51494cd1201f1cd4c30972899b20619509e1be09e1298243e52a1a9bb"},{"path":"references/schemas/lifecycle_verifier_binding.schema.json","sha256":"bf191ba767f6ae74dfc32b477f02ff1f4cadbab962ebbe3e48c1fa3932e5d5ff"},{"path":"references/schemas/canonical_bibliography_snapshot.schema.json","sha256":"a2f75e86d2fde19f0e22a0bfe7ba15b74ab4830bcdf1b37039d016cfee4f0721"},{"path":"references/schemas/canonical_extract_receipt.schema.json","sha256":"96df55e74e28b80703cdec695aad49703d0bb60ef5c545524fdfa5dfb9eb914e"},{"path":"references/schemas/centroid_semantic_execution.schema.json","sha256":"f4e428741fc1f1f9542f077a0ff134bc4d71b54043965d227591d65419bbcec3"},{"path":"references/schemas/centroid_semantic_execution.v3.schema.json","sha256":"0ce982c8715744d57a8e37cfd6f1ff95e4a57c474ba833506adac072ca76702a"},{"path":"references/schemas/evidence_publication_claim.schema.json","sha256":"a84e78c0815d75183c9928bb1211f014aa8dc9fcfc0186091097f41a201ceb37"},{"path":"references/schemas/evidence_publication_journal.schema.json","sha256":"b24eb155816c62de6e0a23e8f23feb3c09211984f1b1a8ad1dbc4052a804754e"},{"path":"references/schemas/product_assurance.schema.json","sha256":"a10b8cf9857b4c787e5881381751192f14802af88c95c27db8995c5a219b8db9"},{"path":"references/schemas/product_assurance.v2.schema.json","sha256":"6d9415adb619e6cf93676aeb333ca70386cdee27eb1e48c18df7adf4c9817a9f"},{"path":"references/schemas/semantics_manifest.schema.json","sha256":"c8405570791fc39260d8d78c74f5b7e332c3edbba9e447f1779b6460c27e64a9"},{"path":"references/schemas/verifier_blocker.schema.json","sha256":"cbe1ddb007e6efe2a0827d4c473f6641fedc9f9ab67c2443d4011676b3b470a7"},{"path":"references/schemas/verifier_commit_marker.schema.json","sha256":"e2bbf719f2f46df6767e2b26e4f13773e6fa6460f26ef0e8360db24af2bd6bdf"},{"path":"references/schemas/verifier_publication_manifest.schema.json","sha256":"5187cd64f4a8489de8ee71faf87ffbfed632d946b96260e369b516f44f34cd93"},{"path":"references/schemas/verifier_transaction.schema.json","sha256":"0b3e46d338c41d983af32ad5090a0f48da413fc73c984d077c1a305104cb21a8"},{"path":"scripts/assignment_dispatch_claim.py","sha256":"27f56cab1194ed0533f771bd191a49a8396936c41e8587fcd046ffa48e5c357d"},{"path":"scripts/assignment_mutation_anchor.py","sha256":"7d98411f84172fe7519f08d4427fd5fa8be16b456912d71ffbc12ed4df41e350"},{"path":"scripts/assignment_receipt_transaction.py","sha256":"1702605e5e4387457f9f124c30545d2653a16943910dddb15e71149064fa0499"},{"path":"scripts/c2_evidence_validation.py","sha256":"f2a47b2954fcf63bc116875df780dbd2e0b8ac3271974d8a490cc295b26d9733"},{"path":"scripts/canonical_bibliography.py","sha256":"e314d6736a80b8d895af44737fe6cbcdea1cf576a436552ee75fb0fe2271b2e1"},{"path":"scripts/destination_capability.py","sha256":"660b2b59aea4b48677ac9dc47ce6e0c1d6d8f95cce3bc0399247f5d73d4dc479"},{"path":"scripts/draft_evidence_verifier.py","sha256":"cc37be3dfe3b1bf48f16054a36797fe526cd4fb4c801356bc12923469cc0a65a"},{"path":"scripts/evidence_publication.py","sha256":"41b701ae1f1c4eae9352fb4871eb6307581f850168fd61e25652b10d0966c77c"},{"path":"scripts/product_assurance.py","sha256":"70cf23995ad509e9f8b125cbf389dcd9888c4668acd4623a836d9591afe4847c"},{"path":"scripts/reader_accessibility_policy.py","sha256":"70e5ff601299149e14c1c602d9ccd7fd46dea2cfc2ae12376b347a9775a82eff"},{"path":"scripts/source_extract.py","sha256":"96c90d56cecb6f873dde61c312ed1eb51fee5133635292dc711d62e58ee4c41c"}],"phase":"generation","product_assurance":{"evidence_type":"product_assurance_v2","path":"reviews/.harness/verifier/terminal-m1/generation/product-assurance.json","root":{"discovery":"explicit:reviews/.harness/fixtures/terminal-m1/synthetic-project-manifest.json","identity":"c2-synthetic-project","kind":"project","manifest_sha256":"c4b8d95709994f81093641c7a4739267e8539b7d20a9d6dcb45552433c7104f6"},"sha256":"8b7e3d30dd64a47eab933e89d73f9ecb75002715ae5b954052c81ea5e79ce5de"},"product_disposition":"evaluation_ready","qualification_mode":"governed_v3","requested_independence_level":"none","schema_version":"1.0.0","semantic_receipt":{"evidence_type":"semantic_execution_receipt","path":"reviews/.harness/fixtures/terminal-m1/semantic-execution-3.json","root":{"discovery":"explicit:reviews/.harness/fixtures/terminal-m1/synthetic-project-manifest.json","identity":"c2-synthetic-project","kind":"project","manifest_sha256":"c4b8d95709994f81093641c7a4739267e8539b7d20a9d6dcb45552433c7104f6"},"sha256":"6bb12d0b49f2b2c3bc2a5e756133bed73be35b434d2549ac3357b3f69bf75086"},"semantics_digest":"741fb98b65213223dc0a6f7a51963bb4f68090462992062f8415a9d16c8a3342","semantics_manifest":{"evidence_type":"semantics_manifest","path":"references/semantics_manifest.v1.json","root":{"discovery":"explicit:version.json","identity":"co-author-harness","kind":"harness","manifest_sha256":"4b502fdfff05eb228668af53c37e444d50d3cd3d01ce244ab8c26dcdcb8cfb08"},"sha256":"bff0081411ade7e9230d9b8f3756d35b69b6df15bf1c01c2c300904f5ff79010"},"state":"prepared","transaction_id":"verifier-52f503bbc454ca9f","transaction_type":"draft_evidence_verifier"}
